{
  "methodology": {
    "name": "Arch3",
    "version": "0.1.0",
    "layers": ["context", "containers", "components"]
  },
  "scope": {
    "name": "Minimal Scope",
    "description": "Smallest valid Arch3 model."
  },
  "context": {
    "actors": [],
    "systems": []
  },
  "containers": [],
  "components": []
}
